"published_date",doi,title,authors,affiliations
"January 1st 2016, 00:00:00.000","10.1039/c5cp02994e","An electric double layer of colloidal particles in salt-free concentrated suspensions including non-uniform size effects and orientational ordering of water dipoles","[""Jun-Sik Sin"",""Hak-Chol Pak"",""Kwang-Il Kim"",""Kuk-Chol Ri"",""Dok-Yong Ju"",""Nam-Hyok Kim"",""Chung-Sik Sin""]","[""Kim Il Sung University"",""Pyongyang, DPR Korea"",""College of Physics""]"
"January 1st 2016, 00:00:00.000","10.1155/2016/1871230","Experimental Research on Quick Structural Health Monitoring Technique for Bridges Using Smartphone","[""Xuefeng Zhao"",""Kwang Ri"",""Ruicong Han"",""Yan Yu"",""Mingchu Li"",""Jinping Ou""]","[""School of Software Technology, Dalian University of Technology, Dalian 116000, China"",""School of Electronic Science and Technique, Dalian University of Technology, Dalian 116000, China"",""School of Civil Engineering, Pyongyang University of Architecture, Pyongyang 1001, Democratic People’s Republic of Korea"",""School of Civil Engineering, Dalian University of Technology, Dalian 116024, China"",""State Key Laboratory of Coastal and Offshore Engineering, Dalian University of Technology, Dalian 116024, China"",""School of Civil Engineering, Harbin Institute of Technology, Harbin 150000, China"",""Research Center of Structural Smartphone Cloud Monitoring, Dalian University of Technology, Dalian 116024, China""]"
"January 1st 2016, 00:00:00.000","10.4310/maa.2016.v23.n4.a3","The steady Navier–Stokes and Stokes systems with mixed boundary conditions including one-sided leaks and pressure","[""Tujin Kim"",""Daomin Cao""]","[""Institute of Applied Mathematics, AMSS, Chinese Academy of Sciences, Beijing, China"",""Institute of Mathematics, Academy of Sciences, Pyongyang, DPR Korea""]"
"January 1st 2016, 00:00:00.000","10.1155/2016/6749182","Modeling of Drilling Forces Based on Twist Drill Point Angles Using Multigene Genetic Programming","[""Myong-Il Kim"",""Ping Zou""]","[""School of Mechanical Engineering & Automation, Northeastern University, Shenyang 110819, China"",""School of Mechanical Science & Technology, Kimchaek University of Technology, Pyongyang 999093, Democratic People's Republic of Korea""]"
"December 8th 2015, 00:00:00.000","10.1111/jfb.12815","Differential expression of two C-type lectins in grass carpCtenopharyngodon idellaand their response to grass carp reovirus","[""C. S. Ju"",""L. B. He"",""Y. Y. Pei"",""Y. Jiang"",""R. Huang"",""Y. M. Li"",""L. J. Liao"",""S. H. Jang"",""Y. P. Wang""]","[""University of Chinese Academy of Sciences; Beijing 100049 China"",""State Key Laboratory of Freshwater Ecology and Biotechnology, Institute of Hydrobiology; Chinese Academy of Sciences; Wuhan 430072 China"",""Department of Zoology, College of Life Sciences; Kim Il Song University; Pyongyang Democratic People's Republic of Korea""]"
"March 30th 2015, 00:00:00.000","10.1002/gj.2676","Geochemical characterization of Archaean amphibolites from the eastern part of Anshan-Benxi iron producing area, northeastern China: implication for tectonic setting of BIFs","[""En-De Wang"",""Chang-Ik Han"",""Jian-Ming Xia"",""Jian-Fei Fu"",""Guang-Su Li"",""San-Shi Jia"",""Ye-Kai Men""]","[""School of Resources Exploration; Kimchek University of Technology; Pyongyang 999093 DPR of Korea"",""School of Resources and Civil; Northeastern University; Shenyang 110004 China""]"
"March 25th 2015, 00:00:00.000","10.1002/prot.24782","Optimized distance-dependent atom-pair-based potential DOOP for protein structure prediction","[""Myong-Ho Chae"",""Florian Krull"",""Ernst-Walter Knapp""]","[""Institute of Chemistry and Biochemistry, Freie Universität Berlin; Fabeckstrasse 36a Berlin 14195 Germany"",""Department of Biology; University of Science; Unjong-District Pyongyang DPR Korea""]"
"March 19th 2015, 00:00:00.000","10.1111/wre.12146","Computational analysis of mutated AHAS in response to sulfonylurea herbicides","[""M Choe"",""W Choe"",""I Lee"",""M Wu"",""S Liu""]","[""College of Agriculture; Yanbian University; Yanji Jilin China"",""SAVER; Northeast Forestry University; Harbin Heilongjiang China"",""Agricultural Life Science; Pyongyang University of Science and Technology; Pyongyang Korea"",""School of Physics; Nankai University; Tianjin China""]"
"May 27th 2014, 00:00:00.000","10.1002/rnc.3196","Robust non-fragileH ∞  ∕ L2 − L ∞ control of uncertain linear system with time-delay and application to vehicle active suspension","[""Yongsu Kong"",""Dingxuan Zhao"",""Bin Yang"",""Chenghao Han"",""Kyongwon Han""]","[""College of Mechanical Science and Engineering; Jilin University; Changchun 130022 China"",""Department of Electronics and Automation; Kim Il Sung University; Pyongyang DPR of Korea""]"
"January 1st 2014, 00:00:00.000","10.1155/2014/284216","Terminal Sliding Mode Control of Mobile Wheeled Inverted Pendulum System with Nonlinear Disturbance Observer","[""SongHyok Ri"",""Jian Huang"",""Yongji Wang"",""MyongHo Kim"",""Sonchol An""]","[""Key Laboratory of Ministry of Education for Image Processing and Intelligent Control, School of Automation, Huazhong University of Science and Technology, No. 1037, Luoyu Road, Hongshan District, Wuhan, Hubei 430074, China"",""Faculty of Control Science, University of Science and Technology, Unjong District, Pyongyang 999093, Democratic People's Republic of Korea""]"
"January 1st 2014, 00:00:00.000","10.1155/2014/482837","The Reducibility of a Special Binary Pentanomial","[""Ryul Kim"",""Yun Mi Kim""]","[""Faculty of Mathematics, Kim Il Sung University, Pyongyang, Democratic People’s Republic of Korea"",""Department of Applied Mathematics, Kim Chaek University of Technology, Pyongyang, Democratic People’s Republic of Korea""]"
"January 1st 2013, 00:00:00.000","10.1155/2013/601652","Multiagent Consensus Control under Network-Induced Constraints","[""Won Il Kim"",""Rong Xiong"",""Qiuguo Zhu"",""Jun Wu""]","[""State Key Laboratory of Industrial Control Technology, Zhejiang University, Hangzhou 310027, China"",""Kimchaek Industry University, Pyongyang 999093, Republic of Korea""]"
"January 1st 2013, 00:00:00.000","10.1155/2013/505848","Average Consensus Analysis of Distributed Inference with Uncertain Markovian Transition Probability","[""Won Il Kim"",""Rong Xiong"",""Qiuguo Zhu"",""Jun Wu""]","[""State Key Laboratory of Industrial Control Technology, Zhejiang University, Hangzhou 310027, China"",""Kimchaek Industry University, Pyongyang 999093, Democratic People's Republic of Korea""]"
"January 1st 2013, 00:00:00.000","10.4310/maa.2013.v20.n3.a2","Semigroup-theoretical approach to higher order nonlinear evolution equations","[""Qianshun Chang"",""Tujin Kim"",""Jing Xu""]","[""Institute of Applied Mathematics, AMSS, Chinese Academy of Sciences, Beijing, China"",""School of Statistics and Mathematics, Zhejiang Gongshang University, Hangzhou, China"",""Institute of Mathematics, Academy of Sciences, Pyongyang, Korea""]"
"September 15th 2010, 00:00:00.000","10.1143/jpsj.79.094001","Circuit Simulation of Conversion of Stability Features near Hopf Bifurcation Using Time-Delayed Feedback Coupling","[""Hiroyuki Shirahama"",""Megumi Hashiguchi"",""Kazuhiro Fukushima"",""Chol-Ung Choe"",""Hartmut Benner""]","[""Faculty of Education, Kumamoto University, Kumamoto 860-8555, Japan"",""Faculty of Education, Ehime University, Matsuyama 790-8577, Japan"",""Institute for Solid State Physics, Darmstadt University of Technology, D-64289 Darmstadt, Germany"",""Department of Physics, University of Science, Unjong-District, Pyongyang, D. P. R. Korea""]"
"July 1st 2010, 00:00:00.000","10.1142/9781848166585_0002","PREDICTING PROTEIN COMPLEX GEOMETRIES WITH LINEAR SCORING FUNCTIONS","[""OZGUR DEMIR-KAVUK"",""FLORIAN KRULL"",""MYONG-HO CHAE"",""ERNST-WALTER KNAPP""]","[""Institute of Chemistry and Biochemistry, Freie Universität Berlin, Fabeckstrasse 36A, 14195 Berlin, Germany"",""Department of Biology, University of Science, Unjong-District, Pyongyang, DPR Korea""]"
