"published_date",doi,title,authors,affiliations
"January 2nd 2019, 00:00:00.000","10.1002/srin.201800530","Effect of Sb-Ba-Ce-Si-Fe Post Inoculants on Microstructural and Mechanical Properties of As-Cast Pearlitic Ductile Iron","[""Bok-Gyu Lia"",""Kyong-Ho Sim"",""Ryong-Chol Kim""]","[""Faculty of Material Science and Engineering; Kimchaek University of Technology; Pyongyang 950003 Democratic People's Republic of Korea""]"
"January 1st 2019, 00:00:00.000","10.1145/3341069.3342991","A Study on Features for Improving Performance of Chinese OCR by Machine Learning","[""Chul Kim"",""Jang Su Kim"",""U Ju Kim""]","[""Pyongyang University of Science and Technology, Pyongyang, Democratic People's Republic of Korea"",""George Mason University, Korea, Incheon, Republic of Korea""]"
"January 1st 2019, 00:00:00.000","10.1039/c9ra07586k","Superconducting properties and non-isothermal crystallization kinetics of a Bi2Sr2CaCu2O8+δ (Bi2212) superconductor prepared by the Pechini sol–gel method","[""Xingming Zhao"",""Tianlin Wang"",""Songchol Hong"",""Dalu Sun"",""Nan Wang"",""Guksong Chae"",""Yang Qi""]","[""Department of Materials Physics and Chemistry"",""Department of Physics and Biophysics"",""Pyongyang"",""Northeastern University"",""Shenyang"",""China Medical University"",""School of Materials Science and Engineering"",""Institute of Nano Science and Physical Engineering"",""School of Fundamental Sciences"",""P. R. China"",""Kim Chaek University of Technology"",""Democratic People's Republic of Korea""]"
"January 1st 2019, 00:00:00.000","10.1039/c8ra10524c","Preparation of mesoporous ZnAl2O4 nanoflakes by ion exchange from a Na-dawsonite parent material in the presence of an ionic liquid","[""TongIl Kim"",""HakSung Yun"",""GwangBok Han"",""Jiabiao Lian"",""Jianmin Ma"",""Xiaochuan Duan"",""Lianjie Zhu"",""Wenjun Zheng""]","[""College of Chemistry"",""Institute of Chemistry and Biology"",""Key Laboratory of Advanced Energy Materials Chemistry"",""Nankai University Tianjin"",""Pyongyang"",""School of Chemistry & Chemical Engineering"",""Tianjin University of Technology"",""D. P. R. Korea"",""TKL of Metal and Molecule-Baced Material Chemistry"",""Department of Materials Chemistry"",""University of Science"",""P. R. China"",""Tianjin 300384""]"
"September 14th 2018, 00:00:00.000","10.1080/20479700.2018.1520522","The real-time secondary information support to improve bed utilization and the decision-making","[""Choe Nam Yong"",""Chon Jae Hun""]","["" Pyongyang Medical College, Kim Il Sung University, Pyongyang, Democratic People’s Republic of Korea""]"
"September 11th 2018, 00:00:00.000","10.1002/nme.5955","An improved crack tracking algorithm with self-correction ability of crack path and its application in continuum damage model","[""Kumchol Yun"",""Tae-Jong Kim"",""Paek San Jang"",""Zhenqing Wang"",""Sakaya Ronald""]","[""College of Aerospace and Civil Engineering; Harbin Engineering University; Harbin, 150001 P.R.China"",""Institute of Nano-Physical Engineering; Kimchaek University of Technology; Pyongyang D.P.R. Korea"",""Faculty of Mechanics; Kim Il Sung University; Pyongyang D.P.R. Korea"",""Faculty of Mechanical Engineering; Kimchaek University of Technology; Pyongyang D.P.R. Korea""]"
"September 11th 2018, 00:00:00.000","10.1080/15567036.2018.1514431","A feasibility study of energy recovery of RDF from municipal solid waste","[""O Nam–Chol"",""Pak Hyo–Song"",""Sin Yong–Chol"",""Ri Yong–Hyok"",""Kim Yong–Nam""]","["" E-Library, KIM IL SUNG University, Democratic People’s Republic of Korea, Pyongyang"","" Department of Land Planning, Faculty of Global Environmental Science, KIM IL SUNG University, Democratic People’s Republic of Korea, Pyongyang"","" Department of Environmental Conservation, Faculty of Global Environmental Science, KIM IL SUNG University, Democratic People’s Republic of Korea, Pyongyang""]"
"August 9th 2018, 00:00:00.000","10.3233/jifs-18732","Application of a spectral method to Fractional Differential Equations under uncertainty1","[""Kinam Sin"",""Minghao Chen"",""Chong Wu"",""Kwang Ri"",""Huichol Choi""]","[""Department of Applied Mathematics, Kim Chaek University of Technology, Pyongyang, D.P.R. of Korea"",""Harbin Institute of Technology, Harbin PR China"",""Faculty of Mathematics, Kim Il Sung University, Pyongyang, D.P.R. of Korea""]"
"August 1st 2018, 00:00:00.000","10.1089/acu.2018.1285","Study on the Cerebral Blood Flow Regulatory Features of Acupuncture at Acupoints of the Governor Vessel","[""Yong Il Kim"",""Sung Sik Kim"",""Ryong Sik Sin"",""Yong Jin Pu"",""Gon Ri"",""Kwang Su Rim""]","[""Research Unit of Meridian-Acupuncture-Moxibustion, Pyongyang Medical College of Kim Il Sung University, Pyongyang, Democratic People's Republic of Korea.""]"
"June 1st 2018, 00:00:00.000","10.1142/s0218194018500237","An Empirical Study on Software Defect Prediction Using Over-Sampling by SMOTE","[""Cholmyong Pak"",""Tian Tian Wang"",""Xiao Hong Su""]","[""Kim Il Sung University, Pyongyang, Democratic People’s Republic of Korea"",""Harbin Institute of Technology, Harbin 150001, P. R. China""]"
"April 16th 2018, 00:00:00.000","10.1002/etep.2555","Determination of inductance for suppressing current unbalance of 3 phase inverter under input voltage unbalance condition using MATLAB Simulink","[""Songchol Hyon"",""Jangchol Yu"",""Sunghyok Kim""]","[""Department of Electrical Engineering; Kim Chaek University of Technology; Pyongyang Democratic People's Republic (D.P.R) of Korea""]"
"April 3rd 2018, 00:00:00.000","10.1002/srin.201800007","FE Simulation of the Influence of Roll Diameter Difference on the Plate Curvature during Hot Plate Rolling","[""Ryong-Chol Son"",""Kyong-Ho Sim"",""Sin-Ho O""]","[""Faculty of Material Science and Engineering, Kimchaek University of Technology; Pyongyang 950003 Democratic People's Republic of Korea""]"
"February 6th 2018, 00:00:00.000","10.1002/app.46215","Cauchy stresses and vibration frequencies for the instability parameters of dielectric elastomer actuators","[""Tae-Jong Kim"",""Yanju Liu"",""Jinsong Leng""]","[""Department of Science and Mechanics; Kim Chaek University of Technology; PyongYang 950003 Democratic People's Republic of Korea"",""Department of Astronautic Science and Mechanics; Harbin Institute of Technology, P.O. Box 301, No. 92 West Dazhi Street; Harbin 150001 People's Republic of China""]"
"January 31st 2018, 00:00:00.000","10.1680/jwarm.17.00022","Assessment of Environmental burdens for Municipal Solid Waste management options","[""Nam-Chol O"",""Won-Guk Kim"",""Gwang-Song Kim""]","[""Department of Environmental Conservation, Faculty of Global Environmental Science, KIM IL SUNG University, Pyongyang, the Democratic People's Republic of Korea""]"
"January 15th 2018, 00:00:00.000","10.1080/01411594.2017.1350960","Higher-order Landau phenomenological models for perovskite crystals based on the theory of singularities: a new phenomenology of BaTiO3","[""Ilhwan Kim"",""Kumok Jang"",""Ilhun Kim"",""Lin Li""]","["" Department of Physics, Kim Hyong Jik Normal University, Pyongyang, Democratic People's Republic of Korea"","" College of Science, Northeastern University, Shenyang, People's Republic of China""]"
"January 1st 2018, 00:00:00.000","10.1039/c7ra12766a","The synthesis of a Bi2MoO6/Bi4V2O11 heterojunction photocatalyst with enhanced visible-light-driven photocatalytic activity","[""Chol-Nam Ri"",""Song-Gol Kim"",""Kyong-Sik Ju"",""Hyok-Su Ryo"",""Chol-Ho Mun"",""U-Hyon Kim""]","[""School of Chemistry and Chemical Engineering"",""Institute for Electronic Materials"",""Faculty of Physics"",""Democratic People's Republic of Korea"",""Pyongyang"",""Kim Il Sung University"",""Institute of Advanced Science""]"
"January 1st 2018, 00:00:00.000","10.4310/maa.2018.v25.n1.a2","The non-steady Navier–Stokes systems with mixed boundary conditions including friction conditions","[""Tujin Kim"",""Feimin Huang""]","[""Institute of Applied Mathematics, AMSS, Chinese Academy of Sciences, Beijing, China"",""Institute of Mathematics, Academy of Sciences, Pyongyang, DPR Korea""]"
"January 1st 2018, 00:00:00.000","10.1039/c8ta06553e","A first-principles study on the chemical stability of inorganic perovskite solid solutions Cs1−xRbxPbI3 at finite temperature and pressure","[""Un-Gi Jong"",""Chol-Jun Yu"",""Yun-Hyok Kye"",""Yun-Sim Kim"",""Chol-Ho Kim"",""Son-Guk Ri""]","[""Natural Science Centre"",""Democratic People's Republic of Korea"",""Chair of Semiconductor Engineering"",""Pyongyang"",""Kim Il Sung University"",""Chair of Computational Materials Design"",""Faculty of Materials Science""]"
"December 29th 2017, 00:00:00.000","10.1080/00036811.2017.1419203","Convergence rate of stationary solutions to outflow problem for full Navier–Stokes equations","[""Yazhou Chen"",""Hakho Hong"",""Xiaoding Shi""]","["" Department of Mathematics, School of Science, Beijing University of Chemical Technology, Beijing, People’s Republic of China."","" Institute of Mathematics, State Academy of Sciences, Pyongyang, Democratic People’s Republic of Korea.""]"
"December 18th 2017, 00:00:00.000","10.1142/s0219691318500121","An appropriate thresholding method of wavelet denoising for dropping ambient noise","[""Kim Kyong Il"",""Ri Ui Hwan"",""Chon Bong Pil""]","[""Institute of Electronic Material, Academy of Ultramodern Science, Kim Il Sung University, Ryongnam-Dong, Taesong District, Pyongyang, DPR of Korea""]"
"December 7th 2017, 00:00:00.000","10.1063/1.5002607","Influence of solvent polarization and non-uniform ion size on electrostatic properties between charged surfaces in an electrolyte solution","[""Jun-Sik Sin""]","[""Department of Physics, Kim Il Sung University, Taesong District, Pyongyang, North Korea""]"
"November 29th 2017, 00:00:00.000","10.1002/andp.201700259","Unity-Order Nonlinear Optical Index Change in Epsilon-Near-Zero Composite Materials of Gain Media and Metal Nanoparticles","[""Kwang-Hyon Kim""]","[""Institute of Lasers; State Academy of Sciences; Unjong District Pyongyang Democratic People's Republic of Korea""]"
"November 28th 2017, 00:00:00.000","10.1080/10420150.2017.1395879","The cross sections of the proton nuclear reactions on Ni isotopes","[""Jong-Do An"",""Jae-Sok An"",""Hak-Son Jin"",""Yon-Song Jong""]","["" Department of Energy Science, Kim II Sung University, Pyongyang, DPR of Korea""]"
"November 15th 2017, 00:00:00.000","10.1002/qua.25548","Correlation of bond metallicity measures to electronegativity for binary oxides","[""Chol Jun Kang""]","[""Department of Physics; Kim Il Sung University, RyongNam Dong, TaeSong District; Pyongyang DPR Korea"",""The Abdus Salam International Centre for Theoretical Physics, Condensed Matter and Statistical Physics Section, Strada Costiera 11; 34151 Trieste Italy""]"
"November 14th 2017, 00:00:00.000","10.1002/pssb.201700527","Epsilon-Negative Active Composites: Loss-Free and Amplifying Plasmonic Materials","[""Kwang-Hyon Kim""]","[""Institute of Lasers, State Academy of Sciences; Unjong District Pyongyang Democratic People's Republic of Korea""]"
"November 1st 2017, 00:00:00.000","10.1099/ijsem.0.002168","Deinococcus taklimakanensis sp. nov., isolated from desert soil","[""Zuobing Liu"",""Myong Chol Kim"",""Liqiu Wang"",""Guoxin Zhu"",""Yumin Zhang"",""Yao Huang"",""Ziyan Wei"",""Wangmu Danzeng"",""Fang Peng""]","[""\n               \n                  1​China Center for Type Culture Collection (CCTCC), College of Life Sciences, Wuhan University, Wuhan 430072, PR China\n            "",""\n               \n                  3​Hubei Provincial Cooperative Innovation Center of Industrial Fermentation, Wuhan 430072, PR China\n            "",""\n               \n                  2​College of Life Sciences, Kim Il Sung University, Pyongyang, DPR of Korea\n            ""]"
"October 12th 2017, 00:00:00.000","10.1142/s0218348x17500633","A NEW NONLINEAR FRACTAL INTERPOLATION FUNCTION","[""SONGIL RI""]","[""Department of Mathematics, University of Science, Pyongyang, D. P. R. Korea""]"
"September 4th 2017, 00:00:00.000","10.1080/10420150.2017.1365865","Improvement of modified analytic embedded atom method potentials for noble metals and Cu","[""Chong-Guk Jon"",""Hak-Son Jin"",""Chol-Jun Hwang""]","["" Energy Science, Kim Il Sung University, Pyongyang, DPR Korea""]"
"August 28th 2017, 00:00:00.000","10.1080/00986445.2017.1367670","A New Waste Characterization Method for the Anaerobic Digestion Based on ADM1","[""Hoil Kil"",""Yugeng Xi"",""Dewei Li""]","["" Department of Automation, Shanghai Jiao Tong University, Shanghai, China"","" Department of Automation, Kim Il Sung University, Pyongyang, DPR of Korea""]"
"August 16th 2017, 00:00:00.000","10.1021/acs.energyfuels.7b00048","Kinetic Analysis of H2S Removal over Mesoporous Cu–Mn Mixed Oxide/SBA-15 and La–Mn Mixed Oxide/KIT-6 Sorbents during Hot Coal Gas Desulfurization Using the Deactivation Kinetics Model","[""Yong-Son Hong"",""Kye-Ryong Sin"",""Jong-Su Pak"",""Chol-Jin Kim"",""Bing-Si Liu""]","[""Department of Chemistry, School of Science, Tianjin University, Tianjin 300072, People’s Republic of China"",""Department of Chemistry, Kim Hyong Jik Normal University, Pyongyang, Democratic People’s Republic of Korea"",""Department of Chemistry, Kim Il Sung University, Pyongyang, Democratic People’s Republic of Korea""]"
"July 21st 2017, 00:00:00.000","10.3233/jifs-162374","Fractional Jacobi operational matrix for solving Fuzzy Fractional Differential Equation1","[""Kinam Sin"",""Minghao Chen"",""Huichol Choi"",""Kwang Ri""]","[""Department of Applied Mathematics, Kim Chaek University of Technology, Pyongyang, D.P.R. of Korea"",""Department of Mathematics, Harbin Institute of Technology, Harbin, PR China"",""Faculty of Mathematics, Kim Il Sung University, Pyongyang, D.P.R. of Korea""]"
"July 20th 2017, 00:00:00.000","10.3233/thc-171338","A novel lung cancer detection algorithm for CADs based on SSP and Level Set","[""Hongbo Zhu"",""Chun-Hyok Pak"",""Chunhe Song"",""Shengchang Dou"",""Hai Zhao"",""Peng Cao"",""Xiangyun Ye""]","[""Electronic Engineering faculty, Kim Chaek University of Technology, Pyongyang 999093, DPRK"",""Shenyang Institute of Automation, Chinese Academy of Sciences, Shenyang, Liaoning, China"",""Shanghai Chest Hospital, Shanghai Jiaotong University, Shanghai, China"",""School of Public Foundation, China Medical University, Shenyang, Liaoning, China"",""School of Computer Science and Engineering, Northeastern University, Shenyang, Liaoning, China""]"
"July 6th 2017, 00:00:00.000","10.1002/andp.201700103","Slow and Stopped Light in Active Gain Composite Materials of Metal Nanoparticles: Ultralarge Group Index-Bandwidth Product Predicted","[""Kwang-Hyon Kim"",""Song-Hyok Choe""]","[""Institute of Lasers; State Academy of Sciences; Unjong District Pyongyang Democratic People's Republic of Korea""]"
"July 3rd 2017, 00:00:00.000","10.1080/13614576.2017.1368404","Using Pi-calculus to Model Dynamic Web Services Composition Based on the Authority Model","[""Sok-Min Han"",""Un-Chol Pang"",""Hyok-Chol Choe"",""Chol-Jun Hwang""]","["" Electronics Library, Kim Il Sung University, Pyongyang, Democratic Peoples’ Republic of Korea"","" College of Computer Science, Kim Il Sung University, Pyongyang, Democratic Peoples’ Republic of Korea""]"
"July 1st 2017, 00:00:00.000","10.1142/s0219498817501304","Maximal and prime k-subsemimodules in semimodules over semirings","[""Song-Chol Han""]","[""Faculty of Mathematics, Kim Il Sung University, Pyongyang, Democratic People’s Republic of Korea""]"
"June 27th 2017, 00:00:00.000","10.1021/acs.jcim.7b00085","Hydrogen Bond Networks and Hydrophobic Effects in the Amyloid β30–35 Chain in Water: A Molecular Dynamics Study","[""KwangHyok Jong"",""Luca Grisanti"",""Ali Hassanali""]","[""SISSA-Scuola Internazionale Superiore di Studi Avanzati, via Bonomea 265, Trieste 34136, Italy"",""Condensed\rMatter and Statistical Physics, International Centre for Theoretical Physics, Strada Costiera 11, Trieste 34151, Italy"",""Department\rof Physics, Kim II Sung University, RyongNam Dong, TaeSong District, Pyongyang, D.P.R., Korea""]"
"May 27th 2017, 00:00:00.000","10.1080/09205063.2017.1333698","Synthesis of pH-responsive N-acetyl-cysteine modified starch derivatives for oral delivery","[""Kwanghyok Jong"",""Benzhi Ju"",""Shufen Zhang""]","["" Department of Application Chemistry, KimChaek University of Technology, Pyongyang, Democratic People’s Republic of Korea"","" State Key Laboratory of Fine Chemicals, Dalian University of Technology, Dalian, PR China""]"
"May 25th 2017, 00:00:00.000","10.1002/chir.22710","A surface molecularly imprinted polymer as chiral stationary phase for chiral separation of 1,1′-binaphthalene-2-naphthol racemates","[""Hongxing Dong"",""Danxia Zhang"",""Hailong Lin"",""Yudan Wang"",""Lijia Liu"",""Meixia Zheng"",""Xiaobo Li"",""Chunhong Zhang"",""Junqing Li"",""Peng Zhang"",""Juhyok So""]","[""College of Power and Energy Engineering; Harbin Engineering University; Harbin China"",""Department of Chemistry; University of Science; Pyongyang Democratic People's Republic of Korea"",""COFCO Nutrition & Health Research Institute; Beijing China"",""Institute of Advanced Marine Materials, Key Laboratory of Superlight Materials & Surface Technology, Ministry of Education, College of Material Science and Chemical Engineering; Harbin Engineering University; Harbin China""]"
"May 22nd 2017, 00:00:00.000","10.1002/pssb.201600837","A computational study of monolayer hexagonal WTe2 to metal interfaces","[""Chol So"",""Han Zhang"",""Yangyang Wang"",""Meng Ye"",""Yuanyuan Pan"",""Ruge Quhe"",""Jing Zhen Li"",""Xiuying Zhang"",""Yunsong Zhou"",""Jing Lu""]","[""Department of Physics; Capital Normal University; Beijing 100037 P.R. China"",""Nanophotonics and Optoelectronics Research Center, Qian Xuesen Laboratory of Space Technology; China Academy of Space Technology; Beijing 100094 P.R. China"",""Department of Energy Science; Kim Il Sung University; Pyongyang D.P.R. Korea"",""Collaborative Innovation Center of Quantum Matter; Beijing 100871 P.R. China"",""State Key Laboratory for Mesoscopic Physics and Department of Physics; Peking University; Beijing 100871 P.R. China"",""State Key Laboratory of Information Photonics and Optical Communications; Beijing University of Posts and Telecommunications & School of Science; Beijing 100876 P.R. China""]"
"March 16th 2017, 00:00:00.000","10.1002/adem.201600804","Enhanced Ductility of a Bimodal Grain Structure Ti-22Al-25Nb Alloy Fabricated by Spark Plasma Sintering ","[""Kyong-Ho Sim"",""Guofeng Wang"",""Yong-Min Li"",""Ju-Yong Jong""]","[""Department of Energy Science; Kim IL Sung University; Pyongyang 950003, Democratic People's Republic of Korea"",""Department of Material Engineering; Kimchaek University of Technology; Pyongyang 950003, Democratic People's Republic of Korea"",""National Key Laboratory for Precision Hot Processing of Metals; Harbin Institute of Technology; Harbin 150001, People's Republic of China""]"
"January 8th 2017, 00:00:00.000","10.1080/1828051x.2016.1274243","Effects of dietary oregano powder supplementation on the growth performance, antioxidant status and meat quality of broiler chicks","[""Chang-Song Ri"",""Xian-Ren Jiang"",""Myong-Ho Kim"",""Jing Wang"",""Hai-Jun Zhang"",""Shu-Geng Wu"",""Valentino Bontempo"",""Guang-Hai Qi""]","["" Key Laboratory of Feed Biotechnology of the Ministry of Agriculture, Feed Research Institute, Chinese Academy of Agricultural Sciences, Beijing, China; "","" Department of Agricultural Life Science, Pyongyang University of Science and Technology, Pyongyang, D.P.R. Korea; "","" Dipartimento di Scienze Veterinarie per la Salute, la Produzione Animale e la Sicurezza Alimentare, Università degli Studi di Milano, Milano, Italy""]"
"January 1st 2017, 00:00:00.000","10.1155/2017/4538540","Free and Forced Vibration Analysis of Airtight Cylindrical Vessels with Doubly Curved Shells of Revolution by Using Jacobi-Ritz Method","[""Fuzhen Pang"",""Haichao Li"",""Kwangnam Choe"",""Dongyan Shi"",""Kwanghun Kim""]","[""College of Shipbuilding Engineering, Harbin Engineering University, Harbin 150001, China"",""Department of Light Industry Machinery Engineering, Pyongyang University of Mechanical Engineering, Pyongyang 999093, Democratic People’s Republic of Korea"",""College of Mechanical and Electrical Engineering, Harbin Engineering University, Harbin 150001, China""]"
"January 1st 2017, 00:00:00.000","10.14475/kjhpc.2017.20.1.26","The Prayer Experiences of Patients with End-Stage Cancer","[""SoonBok Esther Park"",""Won Hee Lee"",""Kyong Hwan Oh""]","[""The National Medical University of Mongolia, Ulaanbaatar, Mongolia."",""Division of Nursing, Yonsei University Health System, Seoul, South Korea."",""Public Health, Pyongyang University of Science and Technology, Pyongyang, North Korea."",""School of Nursing, Yonsei University, Seoul, South Korea.""]"
"January 1st 2017, 00:00:00.000","10.1155/2017/5625396","Experimental Verification for Cable Force Estimation Using Handheld Shooting of Smartphones","[""Xuefeng Zhao"",""Kwang Ri"",""Niannian Wang""]","[""School of Civil Engineering, Pyongyang University of Architecture, Pyongyang 1001, Republic of Korea"",""State Key Laboratory of Coastal and Offshore Engineering, School of Civil Engineering, Dalian University of Technology, Dalian 116024, China""]"
"November 16th 2016, 00:00:00.000","10.1080/10236198.2016.1256392","Generalized baby Mandelbrot sets adorned with halos in families of rational maps","[""HyeGyong Jang"",""YongNam So"",""Sebastian M. Marotta""]","["" Faculty of Mathematics, University of Science Pyongyang, Pyongyang, Korea."","" Department of Mathematics, Boston University, Boston, MA, USA.""]"
"September 28th 2016, 00:00:00.000","10.1115/smasis2016-9066","Feasibility Study for Vision-Based Cable Force Measurement Using Smartphone","[""Xuefeng Zhao"",""Kwang Ri"",""Yan Yu"",""Chunil Kang"",""Mingchu Li"",""Jinping Ou""]","[""Pyongyang University of Architecture, Pyongyang, Korea"",""Kim Il Sung University, Pyongyang, Korea"",""Dalian University of Technology, Dalian, China"",""Harbin Institute of Technology, Harbin, China""]"
"July 22nd 2016, 00:00:00.000","10.1002/jrs.4975","Lipid organization and stratum corneum thickness determinedin vivoin human skin analyzing lipid-keratin peak (2820-3030 cm−1) using confocal Raman microscopy","[""ChunSik Choe"",""Jürgen Lademann"",""Maxim E. Darvin""]","[""Kim Il Sung University; Ryongnam-Dong, Taesong District; Pyongyang Democratic People's Republic of Korea"",""Charité - Universitätsmedizin Berlin; Department of Dermatology, Venerology and Allergology, Center of Experimental and Applied Cutaneous Physiology; Charitéplatz 1 10117 Berlin Germany""]"
"June 13th 2016, 00:00:00.000","10.1115/gt2016-57232","Study on the Reverse Rotating Character Driven by the Backflow on a Centrifugal Fan System","[""Xiaoyun Qu"",""Tong Wang"",""Jongho An""]","[""Kim Chaek Polytechnical University, Pyongyang, Korea"",""Shanghai Jiao Tong University, Shanghai, China""]"
"May 25th 2016, 00:00:00.000","10.1111/jfb.12997","Characterization, expression analysis and localization pattern of toll-like receptor 1 (tlr1) and toll-like receptor 2 (tlr2) genes in grass carpCtenopharyngodon idella","[""L. B. He"",""H. Wang"",""L. F. Luo"",""S. H. Jiang"",""L. Y. Liu"",""Y. M. Li"",""R. Huang"",""L. J. Liao"",""Z. Y. Zhu"",""Y. P. Wang""]","[""University of Chinese Academy of Sciences; Beijing 100049 China"",""Department of Zoology, College of Life Sciences; Kim Il Song University; Pyongyang Democratic People's Republic of Korea"",""State Key Laboratory of Freshwater Ecology and Biotechnology, Institute of Hydrobiology, Chinese Academy of Sciences; Wuhan 430072 China""]"
"May 1st 2016, 00:00:00.000","10.1111/idh.12230","Association between oral health habits and dental caries among children in Pyongyang, Democratic People's Republic of Korea","[""P-L Tarvonen"",""AL Suominen"",""GS Yang"",""YS Ri"",""K Sipilä""]","[""Department of Oral and Maxillofacial Surgery; Medical Research Centre Oulu; Oulu University Hospital; Oulu Finland"",""Oral and Maxillofacial Department; Kuopio University Hospital; Kuopio Finland"",""Korea Education Fund; Pyongyang Democratic People's Republic of Korea"",""Oral Health Care, Department of Social Services and Health Care; Helsinki, City of Helsinki Finland"",""Institute of Dentistry; University of Eastern Finland; Kuopio Finland"",""Research Unit of Oral Health Sciences; Faculty of Medicine; University of Oulu; Oulu Finland"",""Dental Faculty; Pyongyang Medical College; Kim Il Sung University; Pyongyang Democratic People's Republic of Korea""]"
"March 23rd 2016, 00:00:00.000","10.1111/idh.12209","Comparison of two preventive interventions on dental caries among children in Democratic People's Republic of Korea","[""P-L Tarvonen"",""K Sipilä"",""GS Yang"",""JK Kim"",""M-L Lamidi"",""AL Suominen""]","[""Department of Oral and Maxillofacial Surgery; Medical Research Centre Oulu; Oulu University Hospital; Oulu Finland"",""Oral and Maxillofacial Department; Kuopio University Hospital; Kuopio Finland"",""Oral Health Care; Social Services and Health Care; Department of Social Services and Health Care; Helsinki Finland"",""Korea Education Fund; Pyongyang city Democratic People's Republic of Korea"",""Dental Faculty; Pyongyang Medical College; Kim Il Sung University; Pyongyang city Democratic People's Republic of Korea"",""Institute of Dentistry; University of Eastern Finland; Kuopio Finland"",""Research Unit of Oral Health Sciences; Faculty of Medicine; University of Oulu; Oulu Finland"",""Faculty of Health Sciences; University of Eastern Finland; Kuopio Finland""]"
